{
  "schema_version": 1,
  "id": "verdant_courtyard_routine",
  "cycle_seconds": 80,
  "steps": [
    {
      "id": "activity_0_station_step",
      "label": "Garden court - garden",
      "activity_tag": "garden",
      "animation": "garden",
      "duration_seconds": 20,
      "station_id": "activity_0_station"
    },
    {
      "id": "activity_1_station_step",
      "label": "Painting pavilion - tinker",
      "activity_tag": "tinker",
      "animation": "interact",
      "duration_seconds": 20,
      "station_id": "activity_1_station"
    },
    {
      "id": "activity_2_station_step",
      "label": "Seed library - read",
      "activity_tag": "read",
      "animation": "read",
      "duration_seconds": 20,
      "station_id": "activity_2_station"
    },
    {
      "id": "keepsake_station_step",
      "label": "Fern original signal sculpture",
      "activity_tag": "inspect",
      "animation": "idle",
      "duration_seconds": 20,
      "station_id": "keepsake_station"
    }
  ],
  "projects": [],
  "metadata": {
    "simulation_only": true,
    "progress_policy": "No architecture is created by this routine."
  }
}
